{
  "$schema": "../medium-map.schema.json",
  "version": 3,
  "status": {
    "state": "source-backed-draft",
    "culturalSpecialistReviewRequired": true,
    "note": {
      "en": "The physical elements and named beings are backed by the cited historical, museum, folklore or religious sources. The one-to-one card correspondences, rank order and divination method are Online Arcana fiction.",
      "es": "Los elementos físicos y los seres nombrados están respaldados por las fuentes históricas, museísticas, folclóricas o religiosas citadas. Las correspondencias individuales con los naipes, el orden de rangos y el método de adivinación son ficción de Online Arcana."
    }
  },
  "reader": "mictli",
  "culture": {
    "en": "pre-Hispanic Mexica ritual, economic and divine iconography",
    "es": "Iconografía ritual, económica y divina mexica prehispánica"
  },
  "presentation": {
    "rankMode": "count",
    "majorMode": "deity-disk",
    "states": {
      "upright": {
        "en": "aligned",
        "es": "alineado"
      },
      "reversed": {
        "en": "turned",
        "es": "girado"
      }
    },
    "families": {
      "wands": {
        "en": "Eagles",
        "es": "Águilas"
      },
      "cups": {
        "en": "Cempasúchil",
        "es": "Cempasúchil"
      },
      "swords": {
        "en": "Jaguars",
        "es": "Jaguares"
      },
      "pentacles": {
        "en": "Cacao",
        "es": "Cacao"
      }
    }
  },
  "sourceRegistry": [
    {
      "id": "met-eagle",
      "title": "Metropolitan Museum: Mexica eagle-head labret",
      "url": "https://www.metmuseum.org/art/collection/search/310663",
      "note": "Documents eagle imagery and its relationship to Mexica origins and rulership."
    },
    {
      "id": "bm-four-movement",
      "title": "British Museum: cuauhxicalli with Four Movement glyph",
      "url": "https://www.britishmuseum.org/collection/object/E_Am-6185",
      "note": "Documents Mexica solar and calendrical imagery."
    },
    {
      "id": "met-tecpatl",
      "title": "Metropolitan Museum: Mexica tecpatl ritual knife",
      "url": "https://www.metmuseum.org/art/collection/search/929310",
      "note": "Documents Mexica ritual iconography."
    },
    {
      "id": "famsi-day-signs",
      "title": "FAMSI: Aztec calendar day signs reference",
      "url": "http://www.famsi.org/research/loubat/Tonalamatl/index.html",
      "note": "Reference corpus for Mexica calendrical signs and iconography."
    },
    {
      "id": "met-mexica",
      "title": "Metropolitan Museum: Mexica collection context",
      "url": "https://www.metmuseum.org/art/collection/search?geolocation=Mexico&era=A.D.%201400-1600",
      "note": "Museum collection context for Mexica deities, animals, plants and ritual objects."
    }
  ],
  "culturalElementRegistry": [
    {
      "id": "family-wands",
      "name": {
        "en": "Eagles",
        "es": "Águilas"
      },
      "sourceIds": [
        "met-eagle",
        "met-mexica",
        "famsi-day-signs"
      ],
      "sensitivity": "living-indigenous-heritage"
    },
    {
      "id": "family-cups",
      "name": {
        "en": "Cempasúchil",
        "es": "Cempasúchil"
      },
      "sourceIds": [
        "met-eagle",
        "met-mexica",
        "famsi-day-signs"
      ],
      "sensitivity": "living-indigenous-heritage"
    },
    {
      "id": "family-swords",
      "name": {
        "en": "Jaguars",
        "es": "Jaguares"
      },
      "sourceIds": [
        "met-eagle",
        "met-mexica",
        "famsi-day-signs"
      ],
      "sensitivity": "living-indigenous-heritage"
    },
    {
      "id": "family-pentacles",
      "name": {
        "en": "Cacao",
        "es": "Cacao"
      },
      "sourceIds": [
        "met-eagle",
        "met-mexica",
        "famsi-day-signs"
      ],
      "sensitivity": "living-indigenous-heritage"
    },
    {
      "id": "major-quetzalcoatl",
      "name": {
        "en": "Quetzalcōātl",
        "es": "Quetzalcōātl"
      },
      "sourceIds": [
        "met-mexica",
        "famsi-day-signs"
      ],
      "sensitivity": "living-indigenous-heritage"
    },
    {
      "id": "major-tezcatlipoca",
      "name": {
        "en": "Tezcatlipōca",
        "es": "Tezcatlipōca"
      },
      "sourceIds": [
        "met-mexica",
        "famsi-day-signs"
      ],
      "sensitivity": "living-indigenous-heritage"
    },
    {
      "id": "major-huitzilopochtli",
      "name": {
        "en": "Huitzilopochtli",
        "es": "Huitzilopochtli"
      },
      "sourceIds": [
        "met-mexica",
        "famsi-day-signs"
      ],
      "sensitivity": "living-indigenous-heritage"
    },
    {
      "id": "major-tlaloc",
      "name": {
        "en": "Tlāloc",
        "es": "Tlāloc"
      },
      "sourceIds": [
        "met-mexica",
        "famsi-day-signs"
      ],
      "sensitivity": "living-indigenous-heritage"
    },
    {
      "id": "major-chalchiuhtlicue",
      "name": {
        "en": "Chalchiuhtlicue",
        "es": "Chalchiuhtlicue"
      },
      "sourceIds": [
        "met-mexica",
        "famsi-day-signs"
      ],
      "sensitivity": "living-indigenous-heritage"
    },
    {
      "id": "major-xipe-totec",
      "name": {
        "en": "Xipe Tōtec",
        "es": "Xipe Tōtec"
      },
      "sourceIds": [
        "met-mexica",
        "famsi-day-signs"
      ],
      "sensitivity": "living-indigenous-heritage"
    },
    {
      "id": "major-coatlicue",
      "name": {
        "en": "Coatlicue",
        "es": "Coatlicue"
      },
      "sourceIds": [
        "met-mexica",
        "famsi-day-signs"
      ],
      "sensitivity": "living-indigenous-heritage"
    },
    {
      "id": "major-mictlantecutli",
      "name": {
        "en": "Mictlāntēcutli",
        "es": "Mictlāntēcutli"
      },
      "sourceIds": [
        "met-mexica",
        "famsi-day-signs"
      ],
      "sensitivity": "living-indigenous-heritage"
    },
    {
      "id": "major-mictecacihuatl",
      "name": {
        "en": "Mictēcacihuātl",
        "es": "Mictēcacihuātl"
      },
      "sourceIds": [
        "met-mexica",
        "famsi-day-signs"
      ],
      "sensitivity": "living-indigenous-heritage"
    },
    {
      "id": "major-xochipilli",
      "name": {
        "en": "Xōchipilli",
        "es": "Xōchipilli"
      },
      "sourceIds": [
        "met-mexica",
        "famsi-day-signs"
      ],
      "sensitivity": "living-indigenous-heritage"
    },
    {
      "id": "major-xochiquetzal",
      "name": {
        "en": "Xochiquetzal",
        "es": "Xochiquetzal"
      },
      "sourceIds": [
        "met-mexica",
        "famsi-day-signs"
      ],
      "sensitivity": "living-indigenous-heritage"
    },
    {
      "id": "major-tlazolteotl",
      "name": {
        "en": "Tlazōlteōtl",
        "es": "Tlazōlteōtl"
      },
      "sourceIds": [
        "met-mexica",
        "famsi-day-signs"
      ],
      "sensitivity": "living-indigenous-heritage"
    },
    {
      "id": "major-tonatiuh",
      "name": {
        "en": "Tonatiuh",
        "es": "Tonatiuh"
      },
      "sourceIds": [
        "met-mexica",
        "famsi-day-signs"
      ],
      "sensitivity": "living-indigenous-heritage"
    },
    {
      "id": "major-coyolxauhqui",
      "name": {
        "en": "Coyolxāuhqui",
        "es": "Coyolxāuhqui"
      },
      "sourceIds": [
        "met-mexica",
        "famsi-day-signs"
      ],
      "sensitivity": "living-indigenous-heritage"
    },
    {
      "id": "major-mayahuel",
      "name": {
        "en": "Mayahuel",
        "es": "Mayahuel"
      },
      "sourceIds": [
        "met-mexica",
        "famsi-day-signs"
      ],
      "sensitivity": "living-indigenous-heritage"
    },
    {
      "id": "major-xiuhtecuhtli",
      "name": {
        "en": "Xiuhtecuhtli",
        "es": "Xiuhtecuhtli"
      },
      "sourceIds": [
        "met-mexica",
        "famsi-day-signs"
      ],
      "sensitivity": "living-indigenous-heritage"
    },
    {
      "id": "major-tlahuizcalpantecuhtli",
      "name": {
        "en": "Tlahuizcalpantecuhtli",
        "es": "Tlahuizcalpantecuhtli"
      },
      "sourceIds": [
        "met-mexica",
        "famsi-day-signs"
      ],
      "sensitivity": "living-indigenous-heritage"
    },
    {
      "id": "major-centeotl",
      "name": {
        "en": "Centeōtl",
        "es": "Centeōtl"
      },
      "sourceIds": [
        "met-mexica",
        "famsi-day-signs"
      ],
      "sensitivity": "living-indigenous-heritage"
    },
    {
      "id": "major-chicomecoatl",
      "name": {
        "en": "Chicomecōātl",
        "es": "Chicomecōātl"
      },
      "sourceIds": [
        "met-mexica",
        "famsi-day-signs"
      ],
      "sensitivity": "living-indigenous-heritage"
    },
    {
      "id": "major-mixcoatl",
      "name": {
        "en": "Mixcōātl",
        "es": "Mixcōātl"
      },
      "sourceIds": [
        "met-mexica",
        "famsi-day-signs"
      ],
      "sensitivity": "living-indigenous-heritage"
    },
    {
      "id": "major-ehecatl",
      "name": {
        "en": "Ehēcatl",
        "es": "Ehēcatl"
      },
      "sourceIds": [
        "met-mexica",
        "famsi-day-signs"
      ],
      "sensitivity": "living-indigenous-heritage"
    },
    {
      "id": "major-itzpapalotl",
      "name": {
        "en": "Itzpapālōtl",
        "es": "Itzpapālōtl"
      },
      "sourceIds": [
        "met-mexica",
        "famsi-day-signs"
      ],
      "sensitivity": "living-indigenous-heritage"
    }
  ],
  "cards": {
    "major-fool": {
      "itemName": {
        "en": "Quetzalcōātl",
        "es": "Quetzalcōātl"
      },
      "culturalElementIds": [
        "major-quetzalcoatl"
      ],
      "itemDescription": {
        "en": "A stone disk carved directly with the iconography of Quetzalcōātl.",
        "es": "Un disco de piedra tallado directamente con la iconografía de Quetzalcōātl."
      }
    },
    "major-magician": {
      "itemName": {